{
  "schema_version": "frozen-case-inputs-v1",
  "case_id": "inv-pt01-herg-blocker-confirmed",
  "workflow_context": "toxicity_only",
  "subject": {
    "subject_ref": {
      "kind": "analysis",
      "analysis_ref": "ana_d4e9ba6eee5b44d99f5f487763799939"
    },
    "identity": {
      "canonical_smiles": "CC(C)NCC(O)c1ccc(NS(C)(=O)=O)cc1",
      "name_disclosed": true
    }
  },
  "artifacts": [
    {
      "kind": "frozen_analysis",
      "ref": "ana_d4e9ba6eee5b44d99f5f487763799939",
      "content_sha256": "763d22486069ae5387553c517d82198b3554d512f9301edc51e3c2505e221cc7"
    }
  ],
  "evidence": {
    "provider": "snapshot",
    "snapshot": {
      "path_name": "evidence.json",
      "content_sha256": "6a1ece3f4c2810a541297ebc62f036cae702a3ec5056f1a2b2607118a2b4d632"
    },
    "full_text": {
      "inline": true,
      "content_sha256": "df53f503e80a691c217013eea1c3cc6a326e2b3fc1fc20765b1d6ca4d8013e07"
    }
  },
  "contracts": {
    "model": "synthetic-toxicity-fixture-v1 / sair-descriptor-hgb-b0 (synthetic values)",
    "policy": "activity-priority-*-v1 (synthetic thresholds)",
    "parser": "jats-passages-v1",
    "tool_contract": "grounded-answer-v2"
  },
  "turns": [
    {
      "text": "What does the predictor say about hERG for TX-301, and does the available evidence support or contradict that call?"
    }
  ],
  "provenance": {
    "kind": "synthetic_engineering_fixture",
    "admission_status": "not_admitted",
    "sair_status": "unavailable",
    "note": "fictional compounds, invented numbers; machinery only"
  },
  "dependency_groups": {
    "compounds": [
      "CC(C)NCC(O)c1ccc(NS(C)(=O)=O)cc1"
    ],
    "documents": [
      "MED:93011"
    ],
    "measurements": [
      "inv-pt01-herg-blocker-confirmed:p",
      "inv-pt01-herg-blocker-confirmed:ic50"
    ],
    "sources": [
      "MED:93011"
    ]
  }
}
