{
  "schema_version": "frozen-case-inputs-v1",
  "case_id": "inv-pa04-inactive-confirmed",
  "workflow_context": "activity_guided",
  "subject": {
    "subject_ref": {
      "kind": "activity_screening",
      "screening_id": "scr_eb84265826334f44994cb5aa04edf2f8"
    },
    "identity": {
      "canonical_smiles": "OC(=O)c1ccccc1O",
      "name_disclosed": true
    }
  },
  "artifacts": [
    {
      "kind": "screening",
      "ref": "scr_eb84265826334f44994cb5aa04edf2f8",
      "content_sha256": "f82ee6ebd1e0316b2675e9cfb15ff8ad9a350a311edeccf016e5e95a388c661a",
      "stage_status": {
        "screening": "completed_with_toxicity_not_run"
      }
    }
  ],
  "evidence": {
    "provider": "snapshot",
    "snapshot": {
      "path_name": "evidence.json",
      "content_sha256": "6a1ece3f4c2810a541297ebc62f036cae702a3ec5056f1a2b2607118a2b4d632"
    },
    "full_text": {
      "inline": true,
      "content_sha256": "df53f503e80a691c217013eea1c3cc6a326e2b3fc1fc20765b1d6ca4d8013e07"
    }
  },
  "contracts": {
    "model": "synthetic-toxicity-fixture-v1 / sair-descriptor-hgb-b0 (synthetic values)",
    "policy": "activity-priority-*-v1 (synthetic thresholds)",
    "parser": "jats-passages-v1",
    "tool_contract": "grounded-answer-v2"
  },
  "turns": [
    {
      "text": "What does the activity model estimate for TX-314 on EGFR, and does measured evidence support or contradict it?"
    }
  ],
  "provenance": {
    "kind": "synthetic_engineering_fixture",
    "admission_status": "not_admitted",
    "sair_status": "unavailable",
    "note": "fictional compounds, invented numbers; machinery only"
  },
  "dependency_groups": {
    "compounds": [
      "OC(=O)c1ccccc1O"
    ],
    "documents": [
      "MED:93141"
    ],
    "measurements": [
      "inv-pa04-inactive-confirmed:estimate",
      "inv-pa04-inactive-confirmed:ic50"
    ],
    "sources": [
      "MED:93141"
    ]
  }
}
